{
	"name": "Timeout during slow request body read",
	"description": "Tests timeout when client sends request body too slowly",
	"category": "request_timeout",
	"source": {
		"framework": "spikard",
		"inspired_by": "tower-http TimeoutLayer",
		"test_case": "Slow client body upload triggers timeout"
	},
	"handler": {
		"route": "/api/upload",
		"method": "POST",
		"middleware": {
			"request_timeout": {
				"timeout_seconds": 5
			}
		},
		"simulated_delay_ms": 0,
		"response_type": "immediate"
	},
	"request": {
		"method": "POST",
		"path": "/api/upload",
		"body": {
			"data": "large payload"
		},
		"headers": {
			"Content-Length": "1048576"
		}
	},
	"expected_response": {
		"status_code": 504,
		"body": {
			"type": "https://spikard.dev/errors/request-timeout",
			"title": "Gateway Timeout",
			"status": 504,
			"detail": "Request processing exceeded the configured timeout of 5 seconds"
		}
	},
	"tags": ["timeout", "middleware", "504", "slow-client", "upload", "edge-case"],
	"notes": "Client sends large request body slowly, taking >5s to upload - should timeout before handler runs"
}
